{
  "id": "019a2b3c-4d5e-7f00-8a00-000000000020",
  "site_id": "019a2b3c-4d5e-7f00-8a00-000000000001",
  "name": "Raktár hátsó ajtó",
  "instruction": "Ellenőrizd, hogy az ajtó zárva van-e.",
  "tag_type": "nfc",
  "tag_uid": "04:a1:b2:c3:d4:e5:80",
  "lat_e7": 474979000,
  "lng_e7": 190402000,
  "accuracy_dm": 125
}
